{
  "id": "snapdragon-778",
  "name": "Snapdragon 778",
  "vendor": "qualcomm",
  "family": "Snapdragon 7 series",
  "summary": "Name recorded from phone makers' specification pages and launch reports. Chip details have not been compiled yet.",
  "provenance": {
    "default": {
      "class": "official",
      "source": "oppo",
      "url": "https://www.oppo.com/my/smartphones/series-reno/reno10-pro/specs/",
      "checked": "2026-09-18",
      "note": "Chip name as given for the OPPO Reno10 Pro 5G."
    }
  }
}
