{
  "id": "dimensity-7200",
  "name": "Dimensity 7200",
  "vendor": "mediatek",
  "family": "Dimensity 7000",
  "summary": "Name recorded from phone makers' specification pages and launch reports. Chip details have not been compiled yet.",
  "provenance": {
    "default": {
      "class": "official",
      "source": "vivo",
      "url": "https://www.vivo.com/my/products/param/v27",
      "checked": "2026-09-18",
      "note": "Chip name as given for the vivo V27."
    }
  }
}
