{
  "id": "snapdragon-8-elite-extreme-gen-6",
  "name": "Snapdragon 8 Elite Extreme Gen 6",
  "vendor": "qualcomm",
  "family": "Snapdragon 8",
  "tier": "flagship",
  "announced": "2026-09-22",
  "aliases": [
    "8 Elite Extreme Gen 6",
    "SD 8 Elite Extreme Gen 6"
  ],
  "summary": "Qualcomm's top chip for late-2026 flagships, the first mobile processor with CPU cores at 5 GHz. Announced at the 2026 Snapdragon Summit; no test results yet.",
  "process": {
    "node": "2 nm",
    "foundry": "TSMC"
  },
  "cpu": {
    "cores": 8,
    "clusters": [
      {
        "count": 2,
        "core": "Oryon Prime",
        "ghz": 5.0
      },
      {
        "count": 6,
        "core": "Oryon Performance",
        "ghz": 4.0
      }
    ]
  },
  "provenance": {
    "default": {
      "class": "news",
      "source": "lowyat",
      "url": "https://www.lowyat.net/2026/405016/qualcomm-officially-launches-the-snapdragon-8-elite-extreme-gen-6-platform/",
      "checked": "2026-09-23",
      "note": "From Lowyat.NET's report of Qualcomm's announcement."
    }
  }
}
