{
  "id": "snapdragon-7s-gen-4",
  "name": "Snapdragon 7s Gen 4",
  "vendor": "qualcomm",
  "family": "Snapdragon 7 series",
  "summary": "Name recorded from phone makers' specification pages and launch reports. Chip details have not been compiled yet.",
  "provenance": {
    "default": {
      "class": "official",
      "source": "iqoo",
      "url": "https://www.iqoo.com/my/products/param/z11",
      "checked": "2026-09-18",
      "note": "Chip name as given for the iQOO Z11."
    }
  }
}
