{
  "id": "snapdragon-6-gen-4",
  "name": "Snapdragon 6 Gen 4",
  "vendor": "qualcomm",
  "family": "Snapdragon 6 series",
  "summary": "Name recorded from phone makers' specification pages and launch reports. Chip details have not been compiled yet.",
  "provenance": {
    "default": {
      "class": "official",
      "source": "honor",
      "url": "https://www.honor.com/my/phones/honor-x9d/spec/",
      "checked": "2026-09-18",
      "note": "Chip name as given for the HONOR X9d."
    }
  }
}
