{
  "id": "dimensity-7300",
  "name": "Dimensity 7300",
  "vendor": "mediatek",
  "family": "Dimensity 7000",
  "summary": "Name recorded from phone makers' specification pages and launch reports. Chip details have not been compiled yet.",
  "provenance": {
    "default": {
      "class": "official",
      "source": "oppo",
      "url": "https://www.oppo.com/my/smartphones/series-reno/reno12/specs/",
      "checked": "2026-09-18",
      "note": "Chip name as given for the OPPO Reno12 5G."
    }
  }
}
