{
  "id": "apple-a18",
  "name": "Apple A18",
  "vendor": "apple",
  "summary": "Name recorded from phone makers' specification pages and launch reports. Chip details have not been compiled yet.",
  "provenance": {
    "default": {
      "class": "official",
      "source": "apple",
      "url": "https://support.apple.com/en-my/121029",
      "checked": "2026-09-18",
      "note": "Chip name as given for the iPhone 16."
    }
  }
}
