{
  "id": "snapdragon-6s-gen-3",
  "name": "Snapdragon 6s Gen 3",
  "vendor": "qualcomm",
  "family": "Snapdragon 6 series",
  "summary": "Name recorded from phone makers' specification pages and launch reports. Chip details have not been compiled yet.",
  "provenance": {
    "default": {
      "class": "official",
      "source": "honor",
      "url": "https://www.honor.com/my/phones/honor-x7d-5g/spec/",
      "checked": "2026-09-18",
      "note": "Chip name as given for the HONOR X7d 5G."
    }
  }
}
