{
  "id": "helio-g88",
  "name": "Helio G88",
  "vendor": "mediatek",
  "family": "Helio G",
  "summary": "Name recorded from phone makers' specification pages and launch reports. Chip details have not been compiled yet.",
  "provenance": {
    "default": {
      "class": "official",
      "source": "honor",
      "url": "https://www.honor.com/my/phones/honor-x8a/spec/",
      "checked": "2026-09-18",
      "note": "Chip name as given for the HONOR X8a."
    }
  }
}
